<?xml version="1.0" encoding="UTF-8"?>
<igsn:samples
		xsi:schemaLocation="http://igsn.org/schema/kernel-v.1.0 ../xml-validation/igsn-csiro-v2.0.xsd"
		xmlns:igsn="http://igsn.org/schema/kernel-v.1.0"
		xmlns:xsi="http://www.w3.org/2001/XMLSchema-instance">
	<!-- from https://github.com/kitchenprinzessin3880/csiro-igsn-schema/blob/master/example-capricon.xml -->
    <!--igsn:subNamespace>CAP</igsn:subNamespace -->
	<igsn:sample>
		<igsn:sampleNumber identifierType="igsn">CSCAP0001</igsn:sampleNumber>
		<igsn:sampleName>Cap0001-JHP8</igsn:sampleName>
		<igsn:isPublic>1</igsn:isPublic>
		<igsn:landingPage><![CDATA[https://capdf.csiro.au/gs-hydrogeochem/public/ows?service=WFS&version=1.0.0&request=GetFeature&typeName=public:hydrogeochem&cql_filter=sid%3D243]]></igsn:landingPage>
		<igsn:sampleTypes>
			<igsn:sampleType>http://vocabulary.odm2.org/specimentype/precipitationBulk</igsn:sampleType>
		</igsn:sampleTypes>
		<igsn:materialTypes>
			<igsn:materialType>http://vocabulary.odm2.org/medium/snow</igsn:materialType>
		</igsn:materialTypes>
		<igsn:samplingLocation/>
		<igsn:samplingTime/>
		<igsn:sampleCuration>
			<igsn:curation> <!-- nick -->
				<igsn:curator>Mineral Resources Flagship,CSIRO</igsn:curator>
                <igsn:curationLocation>Some location</igsn:curationLocation>
			</igsn:curation> <!-- nick -->
		</igsn:sampleCuration>
        <igsn:classification>rock</igsn:classification>
        <igsn:comments>This is a fake comment</igsn:comments>
        <igsn:otherNames>
            <igsn:otherName>FakeOtherName</igsn:otherName>
        </igsn:otherNames>
        <igsn:purpose>Fake purpose</igsn:purpose>
        <igsn:samplingFeatures>
            <igsn:samplingFeature>
                <igsn:samplingFeatureName>mountain X</igsn:samplingFeatureName>
            </igsn:samplingFeature>
        </igsn:samplingFeatures>
        <igsn:sampleCollectors>
            <igsn:collector>Nick Car</igsn:collector>
        </igsn:sampleCollectors>
        <igsn:samplingMethod>bucket</igsn:samplingMethod>
        <igsn:samplingCampaign>Campaign X</igsn:samplingCampaign>
        <igsn:relatedResources>
            <igsn:relatedResourceIdentifier>abcd1234</igsn:relatedResourceIdentifier>
        </igsn:relatedResources>
        <igsn:logElement event="submitted" timeStamp="2015-09-10T18:20:30" />
	</igsn:sample>
</igsn:samples>


<!--
cvc-complex-type.2.4.a: Invalid content was found starting with element 'igsn:curator'.
One of '{"http://igsn.org/schema/kernel-v.1.0":curation}' is expected.

cvc-complex-type.2.4.b: The content of element 'igsn:renderers' is not complete.
One of '{
	"http://igsn.org/schema/kernel-v.1.0":otherNames,
	"http://igsn.org/schema/kernel-v.1.0":classification,
	"http://igsn.org/schema/kernel-v.1.0":purpose,
	"http://igsn.org/schema/kernel-v.1.0":samplingFeatures,
	"http://igsn.org/schema/kernel-v.1.0":sampleCollectors,
	"http://igsn.org/schema/kernel-v.1.0":samplingMethod,
	"http://igsn.org/schema/kernel-v.1.0":samplingCampaign,
	"http://igsn.org/schema/kernel-v.1.0":relatedResources,
	"http://igsn.org/schema/kernel-v.1.0":comments,
	"http://igsn.org/schema/kernel-v.1.0":logElement}'
is expected.


-->